{
  "schema_version": 1,
  "id": "home-ai-core.official",
  "generated_at": "2026-10-20T04:54:46Z",
  "modules": [
    {
      "schema_version": 2,
      "id": "nvr.module",
      "name": "NVR",
      "description": "HOME AI Core NVR 1.1.6 with Hikvision HCNetSDK 6.1.11.40 and RTSP recording, MP4/HLS playback, snapshots and PTZ. Advanced vendor alarms, voice, diagnostics and remote archive operations are not supported in this SDK profile.",
      "version": "1.1.6",
      "core": ">=0.1.200 <1.0.0",
      "runtime": {
        "type": "docker",
        "docker": {
          "image": "ghcr.io/deadsoulf/home-ai-core_dvr@sha256:55f159af9a067168990ccf6d5e43b85a474bbfc8da6af0da9bb2b17b89c12651"
        },
        "health": {
          "port": 8090,
          "path": "/api/nvr/status"
        }
      },
      "dependencies": [],
      "conflicts": [],
      "permissions": [],
      "capabilities": {
        "requires": [
          "host.docker"
        ],
        "provides": [
          "nvr.service"
        ]
      },
      "host": {
        "architectures": [
          "amd64"
        ]
      },
      "api": {
        "namespace": "nvr.module"
      },
      "lifecycle": [
        "install",
        "upgrade",
        "remove",
        "start",
        "stop",
        "restart"
      ]
    },
    {
      "schema_version": 2,
      "id": "ai.agent",
      "name": "AI Agent",
      "description": "CPU-first AI Agent with slim bundled Ollama; automatic Qwen3 0.6B bootstrap, selectable models and optional NVIDIA GPU runtime.",
      "version": "0.3.2",
      "core": ">=0.1.189 <1.0.0",
      "runtime": {
        "type": "docker",
        "docker": {
          "image": "ghcr.io/deadsoulf/home-ai-core-ai@sha256:cf4ead3da44de0df24b4d503122626ef2e3b14d7ee0804cb46f5d594ed444b06"
        },
        "health": {
          "port": 8080,
          "path": "/health"
        }
      },
      "dependencies": [],
      "conflicts": [],
      "permissions": [
        "ai.chat",
        "ai.providers.manage",
        "ai.actions.approve"
      ],
      "capabilities": {
        "requires": [
          "host.docker"
        ],
        "provides": [
          "ai.agent",
          "ai.chat",
          "ai.providers"
        ]
      },
      "host": {
        "architectures": [
          "amd64",
          "arm64"
        ]
      },
      "api": {
        "namespace": "ai.agent"
      },
      "ui": {
        "navigation": [
          {
            "id": "ai.agent",
            "title": "AI Agent",
            "route": "/modules/ai.agent",
            "icon": "brain-circuit",
            "order": 60
          }
        ]
      },
      "lifecycle": [
        "install",
        "upgrade",
        "remove",
        "start",
        "stop",
        "restart"
      ]
    },
    {
      "schema_version": 2,
      "id": "reference.module",
      "name": "Reference Module",
      "description": "Reference Docker module for validating HOME AI Core module lifecycle and catalog integration.",
      "version": "0.1.0",
      "core": ">=0.1.166 <1.0.0",
      "runtime": {
        "type": "docker",
        "docker": {
          "image": "ghcr.io/deadsoulf/home-ai-reference-module@sha256:60177fb078509ea63e74c9776f92a1dd987e88be2cd0b146cc553ec89f987336"
        }
      },
      "dependencies": [],
      "conflicts": [],
      "permissions": [],
      "capabilities": {
        "requires": [
          "host.docker"
        ],
        "provides": [
          "reference.module"
        ]
      },
      "host": {
        "architectures": [
          "amd64",
          "arm64"
        ]
      },
      "lifecycle": [
        "install",
        "upgrade",
        "remove",
        "start",
        "stop",
        "restart"
      ]
    }
  ]
}
